{"activationEventId":1,"activationSetId":"pact_d07b17ef0e339abb","activationSetSha256":"2990b651e38cc24c549705a1413cb6bc02c69e9f7e1fe90a636fc4b50a1ee64d","bundleId":"pb_89d9518d833b885efecf","environment":"local","retailerId":"retailer-demo","schemaVersion":"retail-pricing-activation-receipt/v1","selectionEvents":[{"eventId":1,"predecessorEventId":null,"recordId":"rselrec_8ab5330a11fe3a6c","recordSha256":"1c91c4ae867a1d1626be0f3ee4b9373a76d49cc516f578886fd0f61da981b425","selectionId":"rsel_10cadb8fbae7956c","state":"candidate"},{"eventId":2,"predecessorEventId":1,"recordId":"rselrec_42302803ef9bbcc2","recordSha256":"f1adb2196704abbfc83a3864e12460ccb1de40cae1949b43b0ce612d7924cb98","selectionId":"rsel_10cadb8fbae7956c","state":"approved"},{"eventId":3,"predecessorEventId":2,"recordId":"rselrec_8ba8be45f44e29b7","recordSha256":"4c8de51cfe419ce52634bfdfe8dff540872d545116c9a6ec5d98832246f47954","selectionId":"rsel_10cadb8fbae7956c","state":"active"}],"tenantId":"tenant-demo","transactionId":"2e250522-c243-4118-a4ff-80e60c5ad71d"}
